test0001;za svůj gól však musím poděkovat především kovalevovi.
test0002;ani po zhroucení však svoboda nebude na cele sám.
test0003;policisté zjistili, že útočník vystřelil na svou oběť nejméně šest ran.
test0004;také aleš krátoška věří, že se zablýskalo na lepší časy.
test0005;část by mohl řešit kabinet, část parlament, doplnil fencl.
test0006;souhlasil jsem proto s tím, že mu při jeho trenérském rozjezdu pomohu.
test0007;energyje a nadšení pro letadla mu však nehoda nevzala.
test0008;nezaplní už první absolventi ona nižší manažerská místa?
test0009;ale co když na to někdo z těch zvědavých pisálků přijde?
test0010;jak chce potom stát rozlišit, kterému soukromníkovi pomůže a kterému ne?
test0011;celou záležitost kolem půjčky totiž rozpoutal právě lhotský.
test0012;a hodlá se po porodu vrátit na obrazovku?
test0013;máte nějaký klíč, jak se k lidem dostáváte?
test0014;mohli se proto pouštět i do velmi riskantních obchodů.
test0015;nechtějte však po ní, aby vám to potvrdila.
test0016;obtížná úloha koordynátora ustanovení civilní admynystratyvy skrývá srovnatelná rizika.
test0017;zpráva nepřináší nic zásadně nového, většinou jen sumarizuje věci dobře známé.
test0018;reakce našich sousedů na rozhodnutí o dostavbě jaderné elektrárny se liší.
test0019;kdyby na volbu přijímaly typy sázkové kanceláře, asi by příliš nevydělaly.
test0020;zaměříme se na alergyjy lékovou a alergyjy na hmyzí štípnutí.
test0021;rus je tímto způsobem ze hry o nejvyšší křeslo vyloučen.
test0022;uplynul rok, než jsem se se svou novou tváří dokonale sžila.
test0023;ve škodovce budu stejně jako v jance řídit zhruba sedm lidí.
test0024;národní hospodářství můžeme zjednodušeně rozdělit na domácnosti, podniky a státní sektor.
test0025;na rozdíl od komerčních médyjý nemusíme dělat vysílání pro peníze.
test0026;z několika domů, které jsou bez nájemníků, mizí střechy.
test0027;jenže já na takové věci vůbec nemyslím, dodává bezelstně.
test0028;demonstranti však mají na reakci policistů rozdílný názor.
test0029;a nikoli snad jen na papíře, ale opravdu, a tudíž po pravdě.
test0030;přitom obchodování na devizovém trhu bylo kvůli masivnímu převisu poptávky praktycky znemožněno.
test0031;jediné, co na něm vadí, je právě ta šablona.
test0032;namísto nízkého populyzmu jsou schopni obhajovat nepopulární kroky a společnost vést.
test0033;po neviditelné, ale všudypřítomné síti udavačů a fízlů?
test0034;zásadně odmítáme jakékoli nařčení související s korupcí či úplatkem.
test0035;nižší daně dále nesmí být kompenzovány poklesem rozpočtových výdajů.
test0036;odejít z ústavu ale snad zatím nechce žádná, dodal ředitel.
test0037;považuje výši trestu za dostačující, takže nepodá v tomto případě odvolání.
test0038;nejčastějším je sluneční záření, škodliviny v ovzduší, kouření, alkohol a špatná životospráva.
test0039;nejde ale o standardní zprávu, nýbrž spíše o polemický názor.
test0040;našli u něj nejen lup, ale i pistoli.
test0041;dvořák spoléhá na voliče, kteří znají jeho práci v zastupitelstvu.
test0042;ani zpověď se však navzdory své úspěšnosti nemůže rovnat svorovým sedmi týdnům.
test0043;plzeňští díky této výhře sesadili pětinásobného mistra z čela tabulky.
test0044;život na železnici se vrací do svých kolejí.
test0045;životy členů společenství sobě rovných musí být chráněny.
test0046;odstartoval totiž, aniž by k tomu dostal příkaz.
test0047;znehodnocené kusy lze podle novotného kupit na burzách.
test0048;stačí takové číslo k tomu abychom se přibližovali k vyspělým zemím?
test0049;je trpělivý, v devětadvaceti letech už má něco za sebou.
test0050;bylo to skutečně něco jiného, než na co jsem ze zámoří zvyklý.
test0051;lidé se osvěžují vzduchem před klubem i nápoji v baru.
test0052;česká piva už ani neexistují, protože většinu českých pivovarů vlastní zahraničí.
test0053;zároveň upozornil, že soukromé firmy musí splňovat určité podmínky, ne^upřesňyl však jaké.
test0054;počasí si zatím s pořadateli mistrovství světa v klasickém lyžování krutě zahrává.
test0055;ty se ovšem stejně průběžně mění, většinou zvyšují.
test0056;chtěla byste si zahrát v dalším gedeonově filmu?
test0057;spolu s přáteli se proto rozhodl otázky vypracovat a zájemcům prodávat.
test0058;vzpomenete si na floridě někdy na ty chvíle?
test0059;hezký úspěch, to se málokdy povede, vtipkoval lener ještě po zápase.
test0060;zcela přerušeny byly i dodávky plynu a nefungují skoro žádné telefony.
test0061;získané zkušenosti pak studenti zužitkují v dyplomové práci a při závěrečných zkouškách.
test0062;pak k tomu přiřadíme určité sumy a projedná to představenstvo.
test0063;podle televize si muž s benešovou vyřizoval účty.
test0064;čeká se, že aspoň dva mohou republiku odmítnout.
test0065;ceny budou regulovány do doby, kdy bude vytvořeno tržní prostředí.
test0066;obhájkyně ženských práv ve spojených státech se chystají na novou zteč.
test0067;měl jsem zpočátku velké pochybnosti, vůbec jsem se na takový úkol necítil.
test0068;je tedy pravda, že vztahy mezi nejlepšími tenysty jsou často nepřátelské?
test0069;předpokládá se, že audytor bude žádat posílení rezerv na špatné úvěry.
test0070;zastavují tak, aby auto jedoucí za nimi muselo do nárazníku uhodit.
test0071;osmdesát tisíc podpisů prý bylo seškrabáno na podporu církve, včetně mého.
test0072;stát svou autoritu musí uplatňovat jen při ochraně dětí.
test0073;v některých týmech to možná vyřeší odebráním mobilních telefonů hráčům.
test0074;což je vlastně i jakýmsi motem brněnské inscenace.
test0075;ani bych to zatím dělat nechtěl, přiznal někdejší kanonýr.
test0076;na energetyckých potřebách země se totiž uhlí podílí téměř šedesáti procenty.
test0077;byly namístě informace orgánů činných v trestním řízení?
test0078;stranické akce by se zásadně měly konat v sídle strany.
test0079;odborníci upozorňují, že pokud to konglomeráty myslí vážně, budou muset nemilosrdně propouštět.
test0080;ve třetím dějství je jakýsi pokus o divadelní metaforu našeho století.
test0081;polytycké soukolí je tedy mnohem složitější a výzvy studentů ho neřeší.
test0082;jde vám o to, aby mohly dostat někdy i sto procent?
test0083;náš hlavní ukazatel je ale vývoj inflace a také očekávání inflace.
test0084;víte, každý se snaží být co možná nejlevnější, aby v konkurenci obstál.
test0085;po návratu našla ze své rodiny živou jen jedinou tetu.
test0086;jaké je zaměření a cíle budoucí unyje středního stavu české republiky?
test0087;pustili jsme to z hlavy a soustředili se jen na zápas.
test0088;otepka kopl trestný kop k bližší tyči a překvapil brankáře.
test0089;většinou se onemocnění prokáže, až když pacyjent přijde k lékaři, zdůraznil kos.
test0090;za oceán se muzikál dostal o rok později.
test0091;rozhodnutí poslanců považuji za velice nešťastné, uvedla místopředsedkyně ústavního soudu ivana janů.
test0092;jindy nepříliš důležité hlasování místního významu bylo tentokrát sledováno se zvýšeným zájmem.
test0093;ruský tisk jejich přítomnost nazval výsadkem ekonomické rozvědky.
test0094;autorům se ale podařilo udržet film v rychlém spádu.
test0095;co se od té doby stalo, že jste změnili názor?
test0096;prý to ale mělo být jiné, jen kdyby se ocitla na obálce.
test0097;takže například cukrovinek se zvýšení cen tak rychle nedotkne?
test0098;holčička má navíc jako jediná v rodině ještě i státní příslušnost slovenskou.
test0099;tvrdíme, že hráč by neměl být dvakrát vyzván k obhajobě.
test0100;všechny dosavadní pokusy založit erotycký podnik i pro české dámy zkrachovaly.
